24.06.2021,"Ryanair, Turkish Airlines",TLV,BAK,3 stops,40h 30m,652
24.06.2021,"Pegasus Airlines, Buta air",TLV,BAK,1 stop,6h 40m,738
24.06.2021,"Turkish Airlines, Buta air",TLV,BAK,1 stop,7h 15m,824
24.06.2021,"Pegasus Airlines, Azerbaijan Airlines",TLV,BAK,1 stop,6h 40m,843
24.06.2021,Turkish Airlines,TLV,BAK,1 stop,6h 20m,910
24.06.2021,"Pegasus Airlines, Buta air",TLV,BAK,1 stop,8h 25m,923
24.06.2021,"Turkish Airlines, Azerbaijan Airlines",TLV,BAK,1 stop,7h 15m,951
24.06.2021,"Pegasus Airlines, Azerbaijan Airlines",TLV,BAK,1 stop,8h 25m,952
24.06.2021,Turkish Airlines,TLV,BAK,1 stop,8h 05m,988
24.06.2021,"Ukraine International Airlines, Buta air",TLV,BAK,1 stop,10h 10m,"1,004"
24.06.2021,"EL AL, Azerbaijan Airlines",TLV,BAK,1 stop,8h 20m,"1,014"
24.06.2021,Emirates,TLV,BAK,1 stop,8h 20m,"1,039"
24.06.2021,"Pegasus Airlines, Turkish Airlines",TLV,BAK,1 stop,10h 50m,"1,053"
24.06.2021,"EL AL, Buta air",TLV,BAK,1 stop,13h 50m,"1,058"
24.06.2021,Turkish Airlines,TLV,BAK,1 stop,13h 15m,910
24.06.2021,Turkish Airlines,TLV,BAK,1 stop,15h 00m,797
