26.06.2021,"Ryanair, Wizz Air",TLV,BAK,3 stops,39h 40m,374
26.06.2021,"Pegasus Airlines, Buta air",TLV,BAK,1 stop,6h 40m,695
26.06.2021,"Pegasus Airlines, Azerbaijan Airlines",TLV,BAK,1 stop,6h 40m,796
26.06.2021,Turkish Airlines,TLV,BAK,1 stop,6h 20m,910
26.06.2021,"Pegasus Airlines, Buta air",TLV,BAK,1 stop,8h 25m,923
26.06.2021,"Turkish Airlines, Buta air",TLV,BAK,1 stop,8h 00m,951
26.06.2021,"Turkish Airlines, Azerbaijan Airlines",TLV,BAK,1 stop,8h 00m,952
26.06.2021,"Pegasus Airlines, Azerbaijan Airlines",TLV,BAK,1 stop,8h 25m,988
26.06.2021,Turkish Airlines,TLV,BAK,1 stop,8h 05m,"1,004"
26.06.2021,Turkish Airlines,TLV,BAK,1 stop,10h 10m,"1,010"
26.06.2021,"Pegasus Airlines, Azerbaijan Airlines",TLV,BAK,1 stop,7h 00m,"1,014"
26.06.2021,Turkish Airlines,TLV,BAK,1 stop,13h 15m,"1,053"
26.06.2021,"Pegasus Airlines, Turkish Airlines",TLV,BAK,1 stop,10h 40m,"1,058"
26.06.2021,Emirates,TLV,BAK,1 stop,8h 20m,910
26.06.2021,Turkish Airlines,TLV,BAK,1 stop,15h 00m,738
26.06.2021,"Georgian Airways, Buta air",TLV,BAK,1 stop,12h 10m,824
